<?xml version="1.0" encoding="UTF-8"?>
<envio xmlns:xsi="http://www.w3.org/2001/XMLSchema-instance" xsi:noNamespaceSchemaLocation="file:/C:/1-DAM/Lenguajes%20de%20Marcas/Repaso_Examen_XML_XPath/Seguros.xsd">
  <poliza>
    <numero>99000000</numero>
    <tomador>Manuel Gonzalez Sanchez</tomador>
    <asegurado nombre="Carlos" apellidos="Sanchez">
      <garantia vigor="S">
        <tipo>Accidentes</tipo>
        <capital>10000</capital>
      </garantia>
      <garantia vigor="S">
        <tipo>Dental</tipo>
        <capital>500</capital>
      </garantia>
    </asegurado>
    <asegurado nombre="Juan" apellidos="López">
      <garantia vigor="N">
        <tipo>Vida</tipo>
        <capital>60000</capital>
      </garantia>
    </asegurado>
  </poliza>
  <poliza externa="S">
    <numero>99000001</numero>
    <tomador>Pedro Martin Gomez</tomador>
    <asegurado nombre="Pedro" apellidos="Martin">
      <garantia vigor="S">
        <tipo>Vida</tipo>
        <capital>80000</capital>
      </garantia>
    </asegurado>
  </poliza>
  <poliza>
    <numero>99000002</numero>
    <tomador>Alfredo Salas Perez</tomador>
    <asegurado nombre="Lucas" apellidos="Montero">
      <garantia vigor="S">
        <tipo>Vida</tipo>
        <capital>90000</capital>
      </garantia>
    </asegurado>
    <asegurado nombre="Carmen" apellidos="Sanchez"></asegurado>
    <asegurado nombre="Maria" apellidos="Fernandez">
      <garantia vigor="S">
        <tipo>Vida</tipo>
        <capital>90000</capital>
      </garantia>
      <garantia vigor="N">
        <tipo>Accidentes</tipo>
        <capital>4000</capital>
      </garantia>
      <garantia vigor="S">
        <tipo>Dental</tipo>
        <capital>300</capital>
      </garantia>
    </asegurado>
  </poliza>
</envio>
